{
  "bundle_id": "bnd:pdf:2026-001",
  "received_at": "2026-06-12T10:00:00Z",
  "source": {
    "kind": "pdf-official",
    "subject_id": "despacho-2026-001",
    "version": "1.0"
  },
  "raw": "JVBERi0xLjQ=",
  "content_type": "application/pdf",
  "declared_hash": "sha256:a1b2c3d4e5f6a1b2c3d4e5f6a1b2c3d4e5f6a1b2c3d4e5f6a1b2c3d4e5f6a1b2"
}
